[
  {
    "source_id": "Q001",
    "status": "proposed",
    "segments": [
      {
        "id": "s001",
        "start": 0,
        "end": 3,
        "kind": "metadata"
      },
      {
        "id": "s002",
        "start": 3,
        "end": 448,
        "kind": "reference"
      },
      {
        "id": "s003",
        "start": 448,
        "end": 449,
        "kind": "layout"
      },
      {
        "id": "s004",
        "start": 449,
        "end": 502,
        "kind": "stem"
      }
    ],
    "items": [
      {
        "id": "Q001",
        "parent_group_id": null,
        "response_kind": "short_answer",
        "source_label_segment_ids": [
          "s001"
        ],
        "stem_segment_ids": [
          "s004"
        ],
        "reference_segment_ids": [
          "s002"
        ],
        "option_groups": [],
        "matching_rows": [],
        "response_template_segment_ids": [],
        "depends_on_item_ids": [],
        "context_reuse": [],
        "disposition": "proposed"
      }
    ],
    "issues": []
  },
  {
    "source_id": "Q043",
    "status": "proposed",
    "segments": [
      {
        "id": "s001",
        "start": 0,
        "end": 171,
        "kind": "reference"
      },
      {
        "id": "s002",
        "start": 171,
        "end": 172,
        "kind": "layout"
      },
      {
        "id": "s003",
        "start": 172,
        "end": 259,
        "kind": "stem"
      }
    ],
    "items": [
      {
        "id": "Q043",
        "parent_group_id": null,
        "response_kind": "short_answer",
        "source_label_segment_ids": [],
        "stem_segment_ids": [
          "s003"
        ],
        "reference_segment_ids": [
          "s001"
        ],
        "option_groups": [],
        "matching_rows": [],
        "response_template_segment_ids": [],
        "depends_on_item_ids": [],
        "context_reuse": [],
        "disposition": "proposed"
      }
    ],
    "issues": []
  },
  {
    "source_id": "Q051",
    "status": "proposed",
    "segments": [
      {
        "id": "s001",
        "start": 0,
        "end": 91,
        "kind": "stem"
      }
    ],
    "items": [
      {
        "id": "Q051",
        "parent_group_id": null,
        "response_kind": "short_answer",
        "source_label_segment_ids": [],
        "stem_segment_ids": [
          "s001"
        ],
        "reference_segment_ids": [],
        "option_groups": [],
        "matching_rows": [],
        "response_template_segment_ids": [],
        "depends_on_item_ids": [],
        "context_reuse": [],
        "disposition": "proposed"
      }
    ],
    "issues": []
  },
  {
    "source_id": "Q057",
    "status": "proposed",
    "segments": [
      {
        "id": "s001",
        "start": 0,
        "end": 153,
        "kind": "stem"
      }
    ],
    "items": [
      {
        "id": "Q057",
        "parent_group_id": null,
        "response_kind": "short_answer",
        "source_label_segment_ids": [],
        "stem_segment_ids": [
          "s001"
        ],
        "reference_segment_ids": [],
        "option_groups": [],
        "matching_rows": [],
        "response_template_segment_ids": [],
        "depends_on_item_ids": [],
        "context_reuse": [],
        "disposition": "proposed"
      }
    ],
    "issues": []
  },
  {
    "source_id": "Q004",
    "status": "proposed",
    "segments": [
      {
        "id": "s001",
        "start": 0,
        "end": 181,
        "kind": "reference"
      },
      {
        "id": "s002",
        "start": 181,
        "end": 182,
        "kind": "layout"
      },
      {
        "id": "s003",
        "start": 182,
        "end": 292,
        "kind": "stem"
      },
      {
        "id": "s004",
        "start": 292,
        "end": 293,
        "kind": "layout"
      },
      {
        "id": "s005",
        "start": 293,
        "end": 313,
        "kind": "option"
      },
      {
        "id": "s006",
        "start": 313,
        "end": 314,
        "kind": "layout"
      },
      {
        "id": "s007",
        "start": 314,
        "end": 336,
        "kind": "option"
      },
      {
        "id": "s008",
        "start": 336,
        "end": 337,
        "kind": "layout"
      },
      {
        "id": "s009",
        "start": 337,
        "end": 363,
        "kind": "option"
      },
      {
        "id": "s010",
        "start": 363,
        "end": 364,
        "kind": "layout"
      },
      {
        "id": "s011",
        "start": 364,
        "end": 389,
        "kind": "option"
      },
      {
        "id": "s012",
        "start": 389,
        "end": 390,
        "kind": "layout"
      },
      {
        "id": "s013",
        "start": 390,
        "end": 418,
        "kind": "option"
      }
    ],
    "items": [
      {
        "id": "Q004",
        "parent_group_id": null,
        "response_kind": "single_choice",
        "source_label_segment_ids": [],
        "stem_segment_ids": [
          "s003"
        ],
        "reference_segment_ids": [
          "s001"
        ],
        "option_groups": [
          {
            "id": "og_1",
            "kind": "choice_bank",
            "options": [
              {
                "id": "opt_1",
                "segment_ids": [
                  "s005"
                ]
              },
              {
                "id": "opt_2",
                "segment_ids": [
                  "s007"
                ]
              },
              {
                "id": "opt_3",
                "segment_ids": [
                  "s009"
                ]
              },
              {
                "id": "opt_4",
                "segment_ids": [
                  "s011"
                ]
              },
              {
                "id": "opt_5",
                "segment_ids": [
                  "s013"
                ]
              }
            ]
          }
        ],
        "matching_rows": [],
        "response_template_segment_ids": [],
        "depends_on_item_ids": [],
        "context_reuse": [],
        "disposition": "proposed"
      }
    ],
    "issues": []
  },
  {
    "source_id": "Q050",
    "status": "proposed",
    "segments": [
      {
        "id": "s001",
        "start": 0,
        "end": 239,
        "kind": "stem"
      }
    ],
    "items": [
      {
        "id": "Q050",
        "parent_group_id": null,
        "response_kind": "short_answer",
        "source_label_segment_ids": [],
        "stem_segment_ids": [
          "s001"
        ],
        "reference_segment_ids": [],
        "option_groups": [],
        "matching_rows": [],
        "response_template_segment_ids": [],
        "depends_on_item_ids": [],
        "context_reuse": [],
        "disposition": "proposed"
      }
    ],
    "issues": []
  },
  {
    "source_id": "Q052",
    "status": "proposed",
    "segments": [
      {
        "id": "s001",
        "start": 0,
        "end": 490,
        "kind": "stem"
      }
    ],
    "items": [
      {
        "id": "Q052",
        "parent_group_id": null,
        "response_kind": "short_answer",
        "source_label_segment_ids": [],
        "stem_segment_ids": [
          "s001"
        ],
        "reference_segment_ids": [],
        "option_groups": [],
        "matching_rows": [],
        "response_template_segment_ids": [],
        "depends_on_item_ids": [],
        "context_reuse": [],
        "disposition": "proposed"
      }
    ],
    "issues": []
  },
  {
    "source_id": "Q056",
    "status": "proposed",
    "segments": [
      {
        "id": "s001",
        "start": 0,
        "end": 87,
        "kind": "reference"
      },
      {
        "id": "s002",
        "start": 87,
        "end": 88,
        "kind": "layout"
      },
      {
        "id": "s003",
        "start": 88,
        "end": 196,
        "kind": "stem"
      }
    ],
    "items": [
      {
        "id": "Q056",
        "parent_group_id": null,
        "response_kind": "short_answer",
        "source_label_segment_ids": [],
        "stem_segment_ids": [
          "s003"
        ],
        "reference_segment_ids": [
          "s001"
        ],
        "option_groups": [],
        "matching_rows": [],
        "response_template_segment_ids": [],
        "depends_on_item_ids": [],
        "context_reuse": [],
        "disposition": "proposed"
      }
    ],
    "issues": []
  },
  {
    "source_id": "Q065",
    "status": "proposed",
    "segments": [
      {
        "id": "s001",
        "start": 0,
        "end": 149,
        "kind": "stem"
      }
    ],
    "items": [
      {
        "id": "Q065",
        "parent_group_id": null,
        "response_kind": "short_answer",
        "source_label_segment_ids": [],
        "stem_segment_ids": [
          "s001"
        ],
        "reference_segment_ids": [],
        "option_groups": [],
        "matching_rows": [],
        "response_template_segment_ids": [],
        "depends_on_item_ids": [],
        "context_reuse": [],
        "disposition": "proposed"
      }
    ],
    "issues": []
  },
  {
    "source_id": "Q071",
    "status": "proposed",
    "segments": [
      {
        "id": "s001",
        "start": 0,
        "end": 3,
        "kind": "metadata"
      },
      {
        "id": "s002",
        "start": 3,
        "end": 196,
        "kind": "reference"
      },
      {
        "id": "s003",
        "start": 196,
        "end": 197,
        "kind": "layout"
      },
      {
        "id": "s004",
        "start": 197,
        "end": 246,
        "kind": "stem"
      }
    ],
    "items": [
      {
        "id": "Q071",
        "parent_group_id": null,
        "response_kind": "short_answer",
        "source_label_segment_ids": [
          "s001"
        ],
        "stem_segment_ids": [
          "s004"
        ],
        "reference_segment_ids": [
          "s002"
        ],
        "option_groups": [],
        "matching_rows": [],
        "response_template_segment_ids": [],
        "depends_on_item_ids": [],